{
 "version": "frozen_2026-10-22_v1",
 "source": "2026-10-23-jack-sample10.md（10-22 stock_latest / 10-20 WO / 10-19 PO）+ JACK_QA.md Q03/Q04/Q06/Q07（2026-10-26）",
 "note": "正式 recon 的唯一库存/PO/WO 基准；10-26 实时只作 provisional_live。",
 "stock": [
  {
   "sku": "TT0031038K0062927",
   "warehouse": "波兰-FZHPoland-covers",
   "available": 157,
   "intransit": 0,
   "waiting": 5,
   "defects": 0
  },
  {
   "sku": "TT0031038K0062927",
   "warehouse": "WayfairCG-Cranbury仓",
   "available": 153,
   "intransit": 0,
   "waiting": 0,
   "defects": 0
  },
  {
   "sku": "TT0031038K0062927",
   "warehouse": "美中-FZH-DANEEY",
   "available": 40,
   "intransit": 201,
   "waiting": 0,
   "defects": 0
  },
  {
   "sku": "C/Linen-Natural-100-688-wow",
   "warehouse": "美东-CENTRADE",
   "available": 21,
   "intransit": 121,
   "waiting": 0,
   "defects": 0
  },
  {
   "sku": "C/Linen-Natural-100-688-wow",
   "warehouse": "WayfairCG-Cranbury仓",
   "available": 34,
   "intransit": 0,
   "waiting": 0,
   "defects": 0
  },
  {
   "sku": "TT0312701K0064561",
   "warehouse": "美东-CENTRADE",
   "available": 181,
   "intransit": 480,
   "waiting": 0,
   "defects": 0
  },
  {
   "sku": "CENCord995-DKGrey-97",
   "warehouse": "美东-CENTRADE",
   "available": 1,
   "intransit": 0,
   "waiting": 0,
   "defects": 0
  },
  {
   "sku": "CENCord995-DKGrey-97",
   "warehouse": "美中-FZH-DANEEY",
   "available": 0,
   "intransit": 0,
   "waiting": 0,
   "defects": 0
  },
  {
   "sku": "CENCord995-DKGrey-97",
   "warehouse": "波兰-FZHPoland-covers",
   "available": 0,
   "intransit": 0,
   "waiting": 0,
   "defects": 0
  },
  {
   "sku": "CENCord995-DKGrey-97",
   "warehouse": "WayfairCG-Cranbury仓",
   "available": 0,
   "intransit": 0,
   "waiting": 0,
   "defects": 0
  },
  {
   "sku": "CENCord995-DKGrey-97",
   "warehouse": "FZH-DANEEY-成品仓",
   "available": 0,
   "intransit": 0,
   "waiting": 0,
   "defects": 0
  },
  {
   "sku": "CENCord995-DKGrey-97",
   "warehouse": "FZH-DANEEY-半成品仓",
   "available": 0,
   "intransit": 0,
   "waiting": 0,
   "defects": 0
  },
  {
   "sku": "C/Cord-White-100-706-wow",
   "warehouse": "美东-CENTRADE",
   "available": 2,
   "intransit": 112,
   "waiting": 0,
   "defects": 0
  },
  {
   "sku": "C/Cord-White-100-706-wow",
   "warehouse": "WayfairCG-Cranbury仓",
   "available": 0,
   "intransit": 0,
   "waiting": 0,
   "defects": 0
  },
  {
   "sku": "C/Velvet-White-100-664-wow",
   "warehouse": "美东-CENTRADE",
   "available": 0,
   "intransit": 0,
   "waiting": 0,
   "defects": 0
  },
  {
   "sku": "C/Velvet-White-100-664-wow",
   "warehouse": "WayfairCG-Cranbury仓",
   "available": 0,
   "intransit": 0,
   "waiting": 0,
   "defects": 0
  },
  {
   "sku": "TT0031010K0062880",
   "warehouse": "FZH-DANEEY-成品仓",
   "available": 0,
   "intransit": 0,
   "waiting": 0,
   "defects": 0
  },
  {
   "sku": "TT0031010K0062880",
   "warehouse": "FZH-DANEEY-半成品仓",
   "available": 0,
   "intransit": 0,
   "waiting": 0,
   "defects": 0
  },
  {
   "sku": "TT0031010K0062880",
   "warehouse": "美中-FZH-DANEEY",
   "available": 0,
   "intransit": 0,
   "waiting": 0,
   "defects": 0
  },
  {
   "sku": "CEN1607NLinen-Ivory-194",
   "warehouse": "美中-FZH-DANEEY",
   "available": 224,
   "intransit": 0,
   "waiting": 0,
   "defects": 0
  },
  {
   "sku": "CEN1607NLinen-Ivory-194",
   "warehouse": "WayfairCG-Cranbury仓",
   "available": 2,
   "intransit": 0,
   "waiting": 0,
   "defects": 0
  },
  {
   "sku": "CENKZ1323-LTGrey-97",
   "warehouse": "WayfairCG-Cranbury仓",
   "available": 17,
   "intransit": 0,
   "waiting": 0,
   "defects": 0
  }
 ],
 "po": [
  {
   "sku": "TT0031038K0062927",
   "warehouse": "美中-FZH-DANEEY",
   "ponum": "PO021716",
   "quantity": 91,
   "in_quantity": 0,
   "status": "0"
  },
  {
   "sku": "TT0031038K0062927",
   "warehouse": "美中-FZH-DANEEY",
   "ponum": "PO021727",
   "quantity": 110,
   "in_quantity": 0,
   "status": "0"
  },
  {
   "sku": "C/Linen-Natural-100-688-wow",
   "warehouse": "美东-CENTRADE",
   "ponum": "PO021717",
   "quantity": 121,
   "in_quantity": 0,
   "status": "0"
  },
  {
   "sku": "TT0312701K0064561",
   "warehouse": "美东-CENTRADE",
   "ponum": "PO021705",
   "quantity": 480,
   "in_quantity": 0,
   "status": "0"
  },
  {
   "sku": "C/Cord-White-100-706-wow",
   "warehouse": "美东-CENTRADE",
   "ponum": "PO021717",
   "quantity": 10,
   "in_quantity": 0,
   "status": "0"
  },
  {
   "sku": "C/Cord-White-100-706-wow",
   "warehouse": "美东-CENTRADE",
   "ponum": "PO021733",
   "quantity": 102,
   "in_quantity": 0,
   "status": "0"
  },
  {
   "sku": "C/Cord-White-100-706-wow",
   "warehouse": "美东-CENTRADE",
   "ponum": "PO021735",
   "quantity": 102,
   "in_quantity": 0,
   "status": "4",
   "b_max_only": true
  }
 ],
 "wo": [
  {
   "sku": "C/Linen-Natural-100-688-wow",
   "item_code": "PK#KS0001-XMMBS-100-HEMPNATURAL",
   "wo": "WO-26-00254",
   "qty": 50,
   "produced_qty": 49,
   "status": "In Process"
  },
  {
   "sku": "C/Linen-Natural-100-688-wow",
   "item_code": "PK#KS0001-XMMBS-100-HEMPNATURAL",
   "wo": "WO-26-01609",
   "qty": 200,
   "produced_qty": 150,
   "status": "In Process"
  },
  {
   "sku": "C/Linen-Natural-100-688-wow",
   "item_code": "PK#KS0001-XMMBS-100-HEMPNATURAL",
   "wo": "WO-26-03171",
   "qty": 50,
   "produced_qty": 0,
   "status": "Not Started"
  },
  {
   "sku": "CENCord995-DKGrey-97",
   "item_code": "PK#KS0001-QDKTR-100-DEEPGREY",
   "wo": "WO-26-00684",
   "qty": 250,
   "produced_qty": 238,
   "status": "In Process"
  },
  {
   "sku": "CENCord995-DKGrey-97",
   "item_code": "PK#KS0001-QDKTR-100-DEEPGREY",
   "wo": "WO-26-03366",
   "qty": 140,
   "produced_qty": 0,
   "status": "Not Started"
  },
  {
   "sku": "C/Cord-White-100-706-wow",
   "item_code": "PK#KS0001-CMKTR-100-WHITE",
   "wo": "WO-26-03118",
   "qty": 70,
   "produced_qty": 0,
   "status": "Not Started",
   "sample10_wo_not_listed": true
  },
  {
   "sku": "TT0031010K0062880",
   "item_code": "PK#KS0121-KQC-194-WHITE",
   "wo": "WO-26-03664",
   "qty": 110,
   "produced_qty": 0,
   "status": "Not Started",
   "sample10_wo_not_listed": true
  },
  {
   "sku": "C/Velvet-White-100-664-wow",
   "item_code": "PK#KS0001-PR-100-WHITE",
   "wo": "WO-26-03110",
   "qty": 100,
   "produced_qty": 0,
   "status": "Not Started",
   "production_conflict": true,
   "conflict_note": "produced_qty=0 vs JC 首工序 sum_qty=110 > qty=100"
  }
 ]
}